,Rate,Review,Label
708,1.0, Htrc mình có đến để đặt bánh sinh nhật ở Anh Hoà Bakery Trần Đại Nghĩa và cực kì khó chịu với cách xử sự của nhân viên ở Bảo vệ thấy khách đến k thèm quay ra ngồi dửng dưng nc như k dắt xe hộ thì ít nhất cx chỉ cho khách chỗ để xe Nhân viên bán hàng thấy khách vào mà mặt như đâm Lạnh hơn K chào hỏi Khách muốn đặt bánh mà cứ chị đợi em chút quay đi túm tụm lại góc hết vs nhau k hiểu Giá cả lộn cùng hệ thống Anh Hoà Bakery mà giá cao hơn hẳn so với các cửa hàng Anh Hoà Thế là Sau khi gọi sang cửa hàng Anh Hoà khác thì nv cuối cùng cx chấp nhận hạ giá xuống VÀ TỪ ĐẤY MẶT NV KHÓ CHỊU NHƯ MÌNH NỢ TIỀN BẠN Ý Nc với khách k những k niềm nở vui vẻ mà lạnh tanh thậm chí là ghét và khó Mình đặt bánh sz lớn để mừng sn sếp đương nhiên phải chọn kĩ Nhưng điều đấy làm bạn nv tỏ thái độ khó chịu dù mình đặt bánh trả tiền chứ k hề xin Cửa hàng nóng và bthg thì ksao nhưng mình bị cò cưa đặt cái bánh mà phải đứng đấy cả tiếng đồng hồ nên rất mồ hôi đầy người rất khó Chất lượng bthg nhưng thái độ phục vụ khách của nv cực kì Khuyên các bạn k nên đặt bánh ở Anh Hoà cơ sở Trần Đại Nghĩa tránh rước bực vào,neg
211,9.8, Không gian trẻ thân thiện lại còn đẹp nữa viên thì phục vụ chu nhiệt uống ở đây rất rất phong phú và có nhiều lựa chọn lắm nhé,pos
37,9.0, Mình ăn chè hay thạch ở nhiều chỗ nhưng phải nói thật chưa chỗ nào làm thạch ngon bằng ở đây có cơ do vừa tiện đường vào ăn miến gần đấy nên mình quyết định chọn Ngọc Thạch Quán ở khu tập thể Kim Liên rất đông dù mình vào là tầm để xe ngay bên cạnh chỗ có cả bảo vệ nên khá yên rộng ngồi ăn luôn ở sân nhiều cây nên rất phải điền tên và tick chọn món trong menu có khi đến lượt họ sẽ bê ra viên của quán mặc đồng phục nhìn chuyên nhanh nhẹn gọi thạch xoài Caramen và thạch chanh Trân châu của quán siêu hình thức dai dai nhưng không bị quá thực sự hài Nước cốt ở dưới thạch là nước chanh leo còn ở bên thạch xoài thơm mùi caramen ăn cùng thì mịn và ăn rất sướng miệng luôn cả thì siêu cho rau câu trân châu và cho cốc có thêm caramen,pos
638,4.0, Phở cuốn ở đây hương vị cực kì bình thường và không có gì đặc Nước chấm chỉ đơn giản là nước mắm thêm nước và dưa góp không Bánh dai và cứng không Thịt thái miếng hơi dày và đun hơi quá lửa nên hơi bị thỉnh thoảng hơi hôi vì còn dính mỡ,neg
791,3.4, Mình đến Swing nhân dịp một hoạt động được tổ chức tại Lúc đến là khoảng trước đó bọn mình đã tụ tập ăn uống khá đầy đủ nên vào Swing với mục đích từ thiện là Tuy nhiên nhân viên ở đây với thái độ vô cùng khó vứt thẳng quyển menu xuống bàn bọn mình mình có người ngồi bán để nghe ca và gắt người gọi cho em đồ uống rồi thanh toán ngay cho Bọn mình chỉ nhẹ nhàng từ chối là bon mình không có nhu cầu nhưng em nhân viên đó vẫn kiên quyết quát lên bắt bọn mình phải gọi đồ Bọn mình khá khó chịu liên hệ vs ban tổ chức đêm nhạc và được khẳng định rằng ko phải bắt buộc gọi đồ uống khi đến Tuy em nhân viên đó tiếp tục với thái độ gắt quát to lên vs bọn mình là phải gọi mỗi ng đồ ko muốn làm to bọn mình chấp nhận gọi đồ và khi thanh toán bạn mình có thẻ KH giảm giá của Swing đưa cho nhân viên thì vẫn nhận được sự quát thẻ của chị đưa ra đây xem khi bê đồ uống ra cho bàn em này tiếp tục đi qua chỗ bọn mình lườm nguýt và có những câu nói tục tĩu với vẻ mặt câng câng thách bọn mình đến là xem ca nhạc ủng hộ từ thiện lại sử dụng dịch vụ của Swing nhưng cách phục vụ bọn mình nhận được lại ko đúng và hợp vừa mất tiền vừa nhận sự bực tức vào Mình thề đây là lần đầu tiên cũng là lần cuối cùng mình bước vào,neg
268,9.0, Lần đầu tiên biết tới quán là qua dễ mặt tiền thoáng và qua buổi trưa nên cửa hàng còn Nhân viên mình cho tiếp vừa đủ lại còn làm việc không bị vấp nữa hàng khá sạch sẽ và không bị ám mùi đồ ăn đâu Không gian khá cũng không quá rộng nhưng cũng không quá Mỗi tội bàn với ghế cao quá Chấm điểm cho món ăn thì xin được khen tấm tắc là ngon lắm lắm lắm ý Có đồ âu á lẫn lộn đi người gọi theo mình gọi suất dành cho người tại ăn cũng nhiều có lẫn heo Ngoài ra mình còn gọi thêm món ngoài món đùi gà hun khói với nước sốt đậm đặc bí truyền của quán ngon theo kiểu cả cơ thể cũng phải vận động để khen ngợi ý dã man vì đi ăn quán mới lần đầu đã ngon giá còn lại còn được trừ vì có đặt bàn qua TableNow ứng dụng kèm với Foody Giá ăn của set thập cẩm là món đùi gà giá là gọi đùi gà còn được tặng kèm món Mình chọn khoai Gọi thêm nước uống tiền sau khi được trừ đi là còn có tất cả những gì mình nhận được thì giá có nhích lên tí nữa cũng vô tư con Hãy đến với quán các bạn sẽ không hối hận,pos
390,5.0, Vào quán để thử vị trí mới trên phố nhớn thống peps thì hầu hết đều mặt tiền các phố nên vị trí dễ tìm không phải vậy các quán đều khá chật chội vì muốn tận dùng diện Riêng Nguyễn Du thì rộng và sáng sủa Phục vụ cũng nhanh nằm trên khu phố có nhiều văn phòng nên khách vào giờ trưa cũng đông hơn thường là dân văn phòng trông khá thanh lịch xinh thích ngắm mấy chị mặc đồ âu sơ mi công ăn cũng tương đương mọi quán,neu
932,2.6, Mới ăn ở Theo cảm nhận của riêng mình thì bún bình chẳng có gì đặc bát bún nhìn khá quán Chỉ ăn một lần ở đây thôi sẽ không quay lại,neg
637,2.8, Nhà hàng này sẽ làm hỏng hình ảnh của hệ thống cowboy jack nước và đồ ăn quá chán phục vụ có vẻ toàn sinh viên làm việc chậm và thiếu chuyên nghiệp sẽ không bao giờ quay lại nữa,neg
949,1.8, Mình hay đến đây ăn lắm nhưg càng ngày càng k thích Giá càng ngày càng đắt Mình đi người cứ ép phỉa gọi nồi Đồ ăn đong lên đĩa thì đong điêu đong ít Phục vụ thì chậm chạp rề rà lúc nhắc thì thái độ với khách Nói chung là bạn bè rủ rê thì đi cùng chứ chả bh muốn ăn ở đây nữa,neg
852,2.2, Kính gửi anh chị e trên diễn thực hôm nay ngẫu nhiên đọc được bài về quán này mình rất lấy làm bức xúc nên có vài ý kiến như mình và bạn hôm đi người đến thái độ của nhân viên trông xe hết sức vô văn phải nói là vô văn hóa mặc dù trông hình thức cũng bóng hất hàm cho khách tự mang xe sang đường gửi ăn nói cục cằn ko có chủ bọn mình gọi nước ép trái nhân viên đựng trong túi mang bọn mình có thắc mắc là tại sao ai cũng có cốc mà bọn mình ko có thì nhận được câu trả đây nước ép nào cũng đựng trong túi bóng thế Qua tìm bọn mình được biết cả tầng chỉ có bọn mình ĐƯỢC uống nước ép bằng túi bóng cắm ống hút và do quán hết Bên cạnh đó giá cả ở quán này rõ ràng cao hơn rất nhiều so với các quán khác dù chất lượng đồ uống rất bình về mình có phản ánh với nhân viên thu tiền dưới tầng rồi lại ra lấy xe và gặp mấy thanh niên trông xe vô văn hóa gây ức chế tập các bạn trẻ có sự lựa chọn sáng suốt khi chọn quán cafe quán có view tốt và vị trí đắc địa nên đông thế Thứ về view thì cũng chẳng ai vào quán rồi ngồi ngó đường vì quán ko có bacony hoàn toàn ngồi trong bên cạnh đó quán rất ồn do mức độ đi lại của phương tiện giao thông tại đoạn thứ quán được cái thuận tiện do gần khu trung tâm mua sắm thứ giá cả rất đắt đỏ so với chất lượng rất bình các bạn cũng tìm hiểu các quán khác ở gần đó để có sự lựa chọn sáng suốt hơn với thái độ nhân viên phục vụ giá cả hợp lý và một không gian thoáng đãng các bạn may,neg
545,5.0, Không gian thoáng mát nhân viên chu đáo Giá cả và chất lượng ok,neu
171,9.0, This is how i define bánh bao nhân thịt bbq huhuuuu best of the best lun ạ đây là món ngon nhất tr menu ở disum nói riêng và cá nhân sở thích của mình là loại bánh bao ngon nhất tr tất cả các thể loại dimsum ở hanoi nchung sánh ngang vs bánh bao kimsa ở Marriot đấy Bánh lúc mang ra vẫn còn vỏ ngoài xốp vàng giòn còn có vị ngọt ngọt ăn tan tr bên trong là thịt bbq mềm vừa có vị ngọt nhẹ vừa có vị mặn mặn ăn siu là perfect combination thật sự rất nghiện tuần nào cũg phải lên làm suất huhu must try musy try nhé mấy tín đồ bánh bao,pos
334,5.0, Tocotoco k có size S anyway không sao vẫn thấy khá là ngonnn gọi hồng trà ô mai mà k thấy vị trà đâu hết chỉ thấy như kiểu nước mơ cộng ô mai chua ép nước với tín đồ hồng trà mà như vậy là mình hem thích lắm à nha về các vị khác mình thấy khá ok vì cũng thử kha khá rồi sữa hơi ngọt chắc là sau phải bảo giảm đường sao thì như vậy cũng khá là được rồi,neu
984,2.6, Đắt khoảng miếng mà bé tí tẹo ngon vỏ ngoài quá giòn thịt hôi nhạt không có vị gì viên phục vụ mặt cau có thịt gà sống khi yêu cầu đổi lại cũng không thèm xin lỗi mà còn thái cuối cùng đến,neg
209,9.0, Ngay mặt đường Quang phong cách trang trí của quán giống quán chủ yếu là tông màu đen nên hơi nhưng khá viên hôm đấy mình gọi trà sữa xoài với chè khoai trà sữa thì phải công nhận ở đây ngon thật kiểu uống ngụm phát tỉnh cả người thơm mùi xoài điểm trừ là lúc mình đến mới mà quán hết cả trân châu đen với số Quán cũng không đông lắm chè khoai dẻo mình thấy khá nhưng phần lớn là đỗ nên mình không thích lắm ghét,pos
921,1.0, Lần đầu tiên mà đi ăn đồ nướng mà hội mình thấy thê thảm đến nằm tít trong cuối rất khó để tìm khách tụi mình đến ăn tối thứ đầu tuần ít khách mà nhân viên không dắt xe cho mà đúng ra là tự dắt vì lúc đó không có nhân Lễ tân tầng cũng không thấy Mình đến muộn cứ tự phải đi lên tầng tìm bàn bạn Bàn mình ngồi goc trong cùng tầng mà còn ngửi thấy mùi khai khai từ nhà vệ Nhân không biết các bạn ấy phục vụ cho bàn khác thế nào nhưng bàn mình người không thấy bạn nào nở nụ cười cảm giác không muốn tiếp thì Mặt như đâm bọn mình gọi thì một lúc sau có nhân viên tới hỏi hả như hình viên Sợ Đồ không các món ăn thì quá nướng cháy vỉ mà mãi mới lẩu nước thì cũng mãi mới Đồ ăn cảm giác hơi bị Rau sống có mùi như nước thịt chảy sợ dã Lúc ăn lẩu gọi mì tôm thì hết mì nhưng nhân viên không nói lại là còn hay Bạn phục vụ khác ra thì bảo bọn em hết mì nhưng bạn ấy không bảo hết Đồ bia sg coca Hoa quả tráng người mà chỉ mang miếng quả miếng ng ăn hết,neg
168,9.0, Các bạn ở hn muốn tìm chỗ ăn dimsum ngon thì đến đây là quá chuẩn luôn Từ tầng lotte nhìn xuống trung tâm thành phố rất Không gian của quán sang lịch Hôm mình ăn còn có anh tây phục vụ đẹp trai dã man chụp ảnh check in ở đây cũng sang chảnh cực Về món ăn thì miễn bàn chỉ có thể nói là rất dimsum nhân đậm vỏ dai cơm gà ngậy béo À riêng có bánh hoa quế thì m ko thích ăn ngọt quá nên thấy hơi,pos
447,4.8, Quán giờ ko có gì đặc vị ngọt ko thực sự gian cách đường nên sạch dễ hợp,neu
696,3.8, Quán khá Được giới thiệu là quán ngon nhưng mà ăn sốt vang thấy thất vọng ghê thì toàn mỡ giá cao so với chất lượng,neg
414,4.8, Quán khá Đi tầm người sẽ thích hơn tụ tập Mình ngồi bên ngoài có Gọi suất bánh mỳ chảo đầy đủ và suất So với quán trước mình ăn thì quán này ăn cũng Chỉ bánh thôi nhưng với mình thì nhanh ngán còn với người khác không biết thế Có wifi,neu
259,10.0, Không gian ấm cúng món ăn hấp nhân viên niền nở đồ tráng miệng ngon vô tuần nào cũng ăn mà vẫn ko thỏa mãn cơn kể chảo bò pho mai ăn thật ngon lẩu gà thơm mùi rượu nếp tạo cảm giác thèm ăn mà ko đừng được,pos
726,3.0, Phở ngon hay không thì tôi không nói Điều tôi muốn nói Thái độ phục thường được khuyến mại ngón tay cái của người bê bát Phải trả tiền người thu tiền mặt lạnh Chỗ Ngồi lộn mạnh ai người ấy Vệ Giấy ăn vứt như bãi chiến Bàn ghế thì bẩn thôi Dù là người Hà dù ngon đến mấy nhưng tôi không muốn quay Tôi bỏ tiền để mua dịch vụ chứ ko xin ai bao giờ,neg
830,4.0, Sẽ gây thích thú bởi decor lạ mắt thời bao cấp cũng như khiến các cụ có vài giờ sống lại khoảng thời gian xưa Mọi thứ về decor âm thanh bát đũa cốc chén đều tuyệt và chuẩn thời xưa nhiên đồ ăn thì k có gì đặc sắc giá hơi cao Gửi xe mất tiền và phục vụ hơi lâu dù mình đến lúc quán chỉ có khách,neg
245,10.0, Đồ tráng miệng phong phú nước uống ngon,pos
1003,3.4, Được hôm để xe máy sang bên không thu để vào mua vềlà lập tức có bảo kê ngồi ý tối còn hoạnh hoẹ là shop đồ bên cạnh nó mở cửa bây Nhỡ mà không nhớ hết đồ vào hỏi món lúc nó đông khách là đuuổi như đuổi không khác gì kiểu đông rồi không thèm khách của xôi Nói chung ngồi lại thì không nói chứ ai mua về nên gọi vác xác ra mua về chỉ tổ gặp lại cái văn hoá bún mắng cháo chửi của dân phố cổ mệt,neg
64,9.2, Kem vani ăn ngon khủng khiếp kem socola thì nhất,pos
699,3.4, Ăn Chảo hơi bé với làm ăn bẩn,neg
737,1.0, Kodo là một trong số ít các quán cafe có nhiều diện tích nhiều view đẹp và có thể tụ tập bạn bè tầng là bàn còn tầng trên cùng là ngồi Đi bộ quá là mỏi chân luôn có quà tặng Galaxy nên được giảm cho dòng Choka và quán rất giảm giá thì tao sẽ làm theo giảm giá nhiều đá nhạt không thấy vị gì hết của Ummi và Quá là thất vọng vì quán viên cũng sao bưng đồ chả bảo mặt còn hằm cả bạn trai ngày thứ hôm còn chưa kể không có crepe thích Kodo chứ bây giờ thì hết đến nhân viên dắt xe cũng hời hợt không hiểu sao khác với ngày đầu nên được training lại,neg
983,2.8, Buồn chiều ngày tớ đặt bàn cho ngày Bạn nữ nghe điện thoại còn nhắc mình là qua đúng ngày đặt bàn cho người khi đúng có quá nửa mọi người thì thấy nhà hàng đóng gọi cho bạn nữ hôm qua đặt bạn ấy còn hồn nhiên bảo ôi thế mình quên ko báo lại cho bạn nhà hàng hôm nay đóng bọn mình ê chề đi bạn mình lại ở khá lại lách cách đi về và tìm quán cái là chiều hôm trước bạn ấy vẫn nhận đặt hôm sau không có một câu báo trước để mình tìm địa điểm thất vọng với cách xử lý của bạn mặc dù chẳng biết có phải chủ quán không nhưng ko hề có thái độ áy náy chút,neg
914,3.4, Đến một lần và chắc không quay đồ ăn bình steak không có mùi nhất là các em phục vụ thì kiểu teen teen và kém chuyên nhà mình đi cùng các cháu có ầm ĩ một em gái ra mặt nặng như đeo gạch nói chị bảo cháu nói bé đúng như kiểu đi đi cho Xong lúc thanh toán một em teen khác định PR gì đó về ưu đãi lần tiếp theo thì em mặt gạch kia chạy ra ngay và thì thầm gì đó ngay trước mặt xong thấy em PR tắt đài Vãi cả phục vụ và chất lượng,neg
493,4.6, Hôm nay mình mới thử Ốc vi cảm nhận đầu tiên là quán khá dễ đối diện quấn cầu phố có rất nhiều Tây qua ăn tầm trưa đi người có gọi nui xào hải càng ghẹ rang cái cuốn tôm thịt và quả dừa mà thất vọng dã nui xào hải sản thì toàn rau và hành đc miếng con nui thì cái cuốn tôm thịt thì nhạt được mỗi càng ghẹ rang me thì tạm dừa thì mình k biết có pha nước đường vào k mà ngọt lợ Giá thì cao xào hải sản cuốn tôm thịt ghẹ rang me quả dừa viên thì lờ quán sẽ vào black list của mình Tạm biệt và ko quay lại,neu
752,1.4, Ăn vài lần rồi nhưng mãi vẫn không thể nào thích quán lại Đồ ăn cũng tàm tạm nhưng lèo tèo ít thịt với Cái chính là thái độ của nhân lúc nào đi qua cũng mời chào rồi còn có lần chặn cả đầu nhất là mấy thg trông xe rất hay trêu con gái nhà người trông như mấy thg du côn bị ngáo mỗi lần đi qua sợ chết khiếp,neg
678,3.4, Quán thì khá là đông nhưng chất lượng thì ko có gì nổi bật chảo có quả trứng và lát pate nhìn k đẹp mắt và cũng k hấp dẫn như các nơi Sốt vang thì ăn nhưng thịt ko trong bát sốt vang toàn nước có mấy miếng thịt và cả mỡ Nói chung k ấn tượng và k có ý định quay lại,neg
562,4.8, Chắc hẳn chẳng ai xa lạ gì với feeling tea cả và chất lượng thì vẫn thể nói đây là hãng trà sữa khá rẻ nên ko thể đòi hỏi chất lượng cao chỉ thấy bh feeling tea đổi mẫu mã đẹp bắt mắt hơn tea chùa láng trên mà đi vào mùa hè thì rất,neu
413,5.0, Nhờ có cái quán crepe đầu ngõ nên mới biết cái quán sâu tít bên trong nhưng cứ đi không khó tìm đâu tượng đầu tiên là trông quán như cái nhà trẻ cái màu xanh thanh sắt trắng Không gian không có chỗ ngồi mấy dễ tính nhưng đồ uống thì chán thôi Hoa quả mix thì chẳng có gì múc lên chỉ thấy miếng dưa hấu to đùng mà cũng không nhớ trong cốc có gì khi ăn xong Sinh tố việt chẳng thấy việt quất toàn đá là màu thì nhạt Chán chẳng buồn nói quay lại nhân viên cũng hem nice Hiuhiu,neu
599,5.0, Mọi thứ đều bình sốt hơi mặn tầng trời mùa hè khá nóg trông cũg k sạch sẽ điều mình k hài lòng nhất là lúc mình đến nhân viên trog quán rõ đông k ai bận gì cả và tất cả đứng nhìn mình loay hoay để xe chả ai ra giúp đỡ đến khi dựng đc xe r bước vào mới có ng hỏi Các bạn k nhiệt tình thì,neu
226,9.2, GongCha lúc nào cũng là IS DA BESTTTTTT luôn luôn cho Earl Grey là một lựa chọn hàng đầu trong số một list đồ uống rất phong phú ở Vị trà siêu kết hợp cùng với hột trân châu trắng và pudding là một sự lựa chọn siêu hoàn Ngồi văn phòng hoặc mỗi lúc buồn ngồi nhâm nhi từng ngụm trà sữa thấy cuộc sống trở nên siêu ngọt,pos
961,3.8, Mình thấy quán trên Ảnh chụp rất feedback rất nhiều và có vẻ khá Hỏi thông tin trên insta thì được rep rất nhiệt Review đọc trên foody ổn nữa nghiên cứu cũng kỹ r nên mình với con bạn quyết định đi khá dễ đi và cách nhà mình không Đến nơi thì thấy hơi thất Dù biết trc là quán nướng vỉa hè nên mình cũng k hy vọng nhiều nhưng bàn mình xếp ngồi ở chỗ sân rửa xe ô Nước vẫn còn nhơm nhớp cả sân Nước đọng lắm muỗi Nhân chị chủ quán tóc tém cá nhìn dễ mến nhưng chắc là cả ngày phục vụ mệt r nên mình thấy chị lạnh lùng cả anh coi xe Cái vỉa hè cao mà xe đứa con gái đẩy mãi không Mà anh ấy cứ đứng đó nhìn Đồ menu nhìn giá cả không quá Nhưng chú ý là nhìn ảnh ngon thôi Đùa bọn mình gọi gà phô mai thấy cũng tàm tạm và suất thì khác hẳn hình Lên hình nhìn chỉnh màu ngon mắt vs đầy đặn thế không Ra ngoài lèo tèo vài miếng vụn vụn j Trông nản luôn phô mai thì Cực Tui HỜN mấy bạn review ngon nhé Chẳng thấy vị gì đặc phô mai không nhai như nhai cao Tok quá thái mỏng nên ăn vào mình nghĩ thành bắp cải Còn gà đáng ra là tâm điểm thì quá quá ăn gà như ăn mình k biết diễn tả như nào nhưng bạn sẽ không nhận ra đó là thịt chứ đừng nói phát hiện ra là gà nướng thì nhạt thái mỏng không ăn ra cái vị j Đến nước chấm cũng nhạt k cứu vớt nổi Chị ý có hỏi mình bạn ăn có vừa miệng Mình bảo chị ấy là nhạt em không cảm nhận đc thì chị ấy hỏi Các bạn ấy vẫn ăn và khen vừa không hiểu chị ý hỏi mình vs lý do tinh tế nào không nhưng mình ếu biết trả lời lại làm sao cũng rất đáng quan ngại khi mà cái cốc đựng nó nhầy nhẫy mỡ Không dám sờ vào luôn Tổng tiền khoảng Ngồi ăn chỗ tối dưới chân đầy nước đen vừa ăn vừa gãi vì muỗi Đồ thì ko ngon một chút nào Mình thấy xót tiền lắm mấy chế ạ hôm đấy bước chân trái ra khỏi nhà nhề cho tôi lý do quán này đc review hẳn,neg
680,3.4, Mình gọi chảo pate bát sốt cái bánh mì và chai chi phí tổng cộng thấy pate trứng bình ăn khá ngấy vì chẳng có nước gì cả nên phải gọi thêm bát sốt hiểu sao quán lại đông thế dù rất xô bồ và chẳng có gì đặc chắc chắn không quay lại lần,neg
712,4.0, đi đây N xanh hay Ôi ôi không bên feeling tea ai trên cho mak hok nhiên nhân viên hơi hơi Camt không riêng quay nhưng yêu cho kem,neg
991,2.2, Đầu tiên là đồ uống quá dở hơn cả là khi so sánh với cái giá tiền bỏ Cái mojito bạn mình uống xong và bảo nó ko khác gì nước dùng bánh bột lọc cho quá nhiều lá bạc còn món nữa thì uống xong chỉ muốn tìm WC để phun ra viên kem hạt điều được khuyến mại dịp thì cũng chán ko Nhân viên thì kinh bọn mình ngồi từ nhưng đến thì nhân viên ra và dọn sạch bàn của bọn mình như kiểu đuổi khách lúc đó khách bắt đầu Và mình bị đau đầu vì cái nhạc ở đó tại mình chưa đạt tới cảnh giới sang chảnh nên ko nghe Nói chung là sẽ không có lần thứ đến dù được mời,neg
803,3.8, Quán này trước kia nổi tiếng là nhưng không hiểu dạo này làm ăn quá Bát mỳ hết sức nhạt nhoà chứ không nói thẳng ra là chán và Giá tiền thì đắt hơn hẳn trong khi các quán mỳ khác ở hàng chiếu rẻ và ngon hơn Nhân viên thì láo lếu lười thái Không quay lại đây ăn lần nào,neg
968,1.0, Có freeship không Mình muốn mua cốc,neg
63,10.0, ngon hết xảy,pos
756,3.4, Hoa quả dầm cx được nhưng có một số hoa quả mình k thích ăn do nó mình háo khá đông đến đúng tầm là không có chỗ ngồi thì mình thấy bình thường n ăn xong no viên phục vụ nhanh chỉ phải đợi chủ quán cx nhiệt tình nữa nhưng do ăn ở vỉa hè nên k đk đảm bảo vệ sinh lắm,neg
757,1.0, Đùa chứ sao mn có thể ăn ở hàng Hoa Béo Kem siêu chán ăn nó bột bột kinh kinh kiểu gì ý tớ hỏi có nhà vs ko đi vào thì thôi rồi toàn dùng tay ko cắt hoa quả xong chỗ đấy thì siêu Đã thế còn ngồi gần cống vs nhà vs thế mà mn vẫn chịu đc Thề kb quay lại luôn ý,neg
