,Rate,Review,Label
202,9.2, Địa điểm yêu thích để ăn Không gian thiết kế đẹp tiết kiệm không không quá ồn đồ ăn uống khá Lần này mình chọn kem hoa quả rất kem tươi ko quán Kèm với hoa quả hơi nhất kem dừa để trong quả dừa xinh nước dừa đi kèm tưoi viên lịch sự chuyên,pos
789,3.6, hôm qua mình có đi nghe Vũ Cát Tường vé hết đến đó họ BẮT BUỘC mình phải gọi thêm đồ mà đồ uốg thì đâu có rẻ lon coca họ lấy nói chung là đắt kinh khủng gian thì rất rất lịch thêm điều nữa là quán nên cấm hút thuốc vì đây là phòng ko phải ai cũng chịu đc mùi khói thuốc ạ,neg
864,3.8, Đánh giá đầu tiên là thái độ nhân viên rất lịch sự và chu Nhưng không thể kéo lại vấn đề về chỗ ngồi và đồ ăn đó lẩu là món không tuy nhiên thoát mùi quá kém có thể vẫn còn dùng hệ thống cũ từ khi Seoul Garden còn ở toàn bộ tầng khách không đông khách hệ thống điều hoà quá tải làm cho không khí ăn lẩu đã nóng lại kéo theo mùi và sự ngột ngạt thật khó món ăn thêm sốt hoặc bao lá rất đậm Nhưng khi vào món lẩu chính thực sự vấn đề mùi và nhiệt độ phòng quá ngột ngạt làm ảnh hưởng tới khẩu Nhìn quanh ai cũng kêu nóng và lau mồ hôi nhiều hơn là gắp đồ món ăn trong thực đơn lẩu không nhiều cũng không co điểm tráng miệng thì không có gì để nhân viên nên có thêm người đứng hướng dẫn khách khách kém ý tránh xục xạo quấy tan nát chè hoặc trái Người đến sau thực nghĩ như một bãi gì đó thay vì góc đồ ăn tráng,neg
190,10.0, Quán gần chỗ mình làm nên khá dễ trong nhà hàng không gian rất thoáng rộng dãi nhiều viên thì nhanh nhẹn phục vụ nhiệt tình và còn có em nhân viên tươi cười phục vụ nướng cho đứa mình từ đầu tới cuối đơn khá phong phú sét nhà mình ăn có tận món cơ ăn bét nhè chè đỗ đen căng tới lỗi không dậy định lần sau mình sẽ quay lại quán này và giới thiệu cho bạn bè mình mà còn lẩu thì tuyệt cú mèo luôn nhá,pos
114,9.6, Bánh chậu cây ngon Trà chanh leo bạc hà với cupcake mini quá tuyệt,pos
602,5.0, Đồ uống ngon nhân viên nhiệt tình,pos
658,1.0, Chỗ để xe thì không có mà lại có cái xe rác trước cửa hàng,neg
207,9.0, Quán ruột của sinh viên ngoại sinh viên và ăn được ăn ở đây rất lượng cũng đảm bảo,pos
519,4.8, Cảm thấy rất có lỗi với Bean ở HĐT cty mình có vô đây Nhóm tầm mỗi ng câu nên k tránh đc ồn ào quá ảnh hướng tới những bàn mình đềf nghị quán kê gộp bàn to nhất ở cửa ra vào để ngồi quây quần k đồng mình có bánh sinh nhật và đề nghị mượn đĩa cắt bánh khi k đồng người order mà quán bị rối và mang đồ nhầm lẫn,neu
418,4.2, Có lẽ đây không phải cảm nhận nhưng theo đánh giá thì món chè mix rất Lần đầu đến quán nên chọn món chủ đạo để nhận Hình thức thì đúng là đẹp như trên ảnh nhưng vị thì rất khó chấp Khá các vị lẫn vào nhau tạo thành một vị rất khó ý tiêu Thậm chí thứ đỗ đen mà họ cho vào còn sượng đến nỗi mình cho là không thể đem ra phục vụ cho người Sẽ k quay,neu
564,5.0, Hôm đi ăn mình gọi gà muối Đồ ăn cũng thịt gà đậm Không gian rất đẹp và Tuy không thể cho điểm cao được vì thái độ phục Chỗ thu ngân thì chị nhân viên xinh mà nhẹ nhàng lịch Nhưng chỗ dọn bàn thì chắc cho Bọn mình đứa vừa mới ăn đứa đang ăn dở mà bạn dọn bàn đến dọn hết đĩa với pepsi chưa đi rồi lau hỏi thêm bọn chị có gọi gì nữa không sau quay lại lau bàn lần nữa và hỏi Có cảm giác như muốn đuổi khách Trong khi nhà hàng ko đông ko thiếu Thật sự gây ức chế,neu
838,2.2, Càng ngày càng bình thường ko ngon như hồi mới mở,neg
926,3.4, ở đây bình thường cũng bình thường còn thái độ nhân viên sercurity thì lấc cấc ăn nói cộc viên trông xe thì lèo nhèo cò quay tiền mình đi xe rut ra cho nv rồi mà cứ lèo nhèo ơi cho e xin thêm đi thế này it quá e ko đủ tiền ăn mấy chục nghìn ko là cái j nhưng mà cái kiểu nhân viên xin xỏ thế này mình gặp lần mình thấy trên fb nhiều bạn cũng nói thế này từ lâu có bạn quản lý vào comment sẽ rút kinh mình tưởng giờ chấn chỉnh lại rồi hoá ra hôm vừa rồi đi vẫn y như sẽ k bgio quay lại the bank,neg
284,9.0, Quán này do bạn gái mình bếch Sau khi nghe con bạn dở hơi tỉ tê là quán này có món bingsu ngon lắm này mặc dù mình cản nhưng vẫn nhất quyết đưa mình đi cho bằng được mới chịu thôi có hai tầng ngồi thì mà chỉ mới ngồi tầng chưa lên tầng nên cũng chưa biết Không gian cũng khá là trẻ đâu đúng là có bingsu ngon Gọi size single cho hai đứa ăn mà cũng bứ Nói chung là đầy cả thì cũng khá cao bát,pos
941,2.6, Quá này phục vụ quá đến ngồi đợi phút ko có thức ăn hỏi nhân viên còn không thèm trả lời hôm qua ngày mình mới đến quán này ở trong vincom nguyễn chí đồ ăn bình nhân viên nói chung ko nên vào quán này mua bực mình,neg
192,9.0, Có thể nói trong các thương hiệu trà sữa nổi tiếng thì Bobabop nằm trong phân khúc giá khá Chỉ tầm cho một cốc trà Up thêm size lớn mất thêm mà cốc to vất uống no cả Topping chỉ từ trân châu mà ú ụ như Mình uống Trà gạo nâu sủi bọt và trà sữa Ceylon đều Kem mặn khá mịn và Nhưng mình order đường mà vẫn thấy hơi Các bạn nên chú ý gia giảm lượng đường cho phù,pos
656,3.8, Quán lúc nào cũng đông nên phải gửi xe bên Ăn kem này hơi thất vọng vì không thật sự kem chỉ mỗi được cái,neg
228,10.0, Cho mình hỏi mình muốn ship đến thanh xuân thì mất bao nhiêu vậy,pos
630,1.0, Food is But boss is a we asked for the price and they told us VND per coconut ice we feel it was overpriced so we asked a group of local Vietnam customer and surprisingly they told us only cost we check back with the and he tell us After finish we go to pay and the boss charges us VND again with a lot of his stupid CHEATER Charges tourists double,neg
253,10.0, Đồ tráng miệng ngon hấp dân nhân viên phục vụ nhanh nhẹn,pos
972,3.8, Hôm ý ngồi trong khói bay mịt mù cay xè hết mắt tẩm ướp không biết ngấm ko nhưng nướng lụi kiểu này chả thấy ngon gì dễ cháy mà ko cháy chắc gì đã chín nghiệm là đĩa dưa góp đừng động vào ăn chả lquan đến nướng mà lại bị cộng thêm tiền chung cá nhân mình ghét ăn nướng lụi dư lày,neg
767,2.4, Hn mình và bạn ăn ở chờ nửa tiếng có đĩa thịt và tiếng mới có bát nản ăn gần hết thịt mới thấy mang ra rau ăn kèm nhân viên thì lóng ngóng quá thịt bò cũng tươi và nước sốt ngon là điểm cộng duy,neg
152,9.0, Sen Hà Thành ở Bùi Thị Xuân đóng cửa thì nhà hàng này khai vị trí trung tâm rất dễ hàng thiết kế theo phong cách châu tầng là lễ ăn ở tầng Đồ ăn phong thơm hải sản giá lại không hề buổi tối không gọi điện đặt bàn trước thường bị hết Nhiều người tổ chức sinh nhật ở bàn người trở lên sẽ được nhà hàng tặng tắt điện thổi nến chúc Nhân viên phục vụ chu đáo lịch Nói chung mọi thứ đều lần sau có dịp nhất định sẽ quay,pos
262,9.0, Vị trí quán này thì ngay mặt lý thương dễ nhìn dễ tìm có món kem ốc quế dài ngoằng ngoẵng như con sâu hot trend từ cuối năm ngoái đầu năm nay thì phải không nhớ rõ nữa chỉ biết là hót gì thì phải một thời gian sau hết hot mình mới bác xác đi ăn chung kem ăn cũng có ba vị socola vani trà Chưa thử hết các sẽ còn quay lại để thử nốt trà xanh xem cả thì không quá cho một chiếc dài ngoằng,pos
497,4.2, Thực sự thì nem rán ở đây cũng ko phải quá là xuất nhưng mà vẫn nằm trong khả năng chấp nhận được nếu như mình được tiếp đón tử Là người nam ra Hà Nội sẽ ko tránh khỏi việc bị phân biệt đối nghe giọng nam cái là thái độ thay đổi từ giọng nói tới thái độ đều tỏ vẻ ko hứng thú với khách miền Hơn suất mà chẳng có miếng rau nào phải mua thêm rau loại củ là thêm Giá đó sẽ là rất bình thường nếu dịch vụ và thái độ phục vụ tốt Nhưng ở đây thì ko đáng với giá đó,neu
323,5.0, Thất vọng và ko bao giờ quay lại Lúc chưa gọi món thì nhà hàng tự động mang một số món thịt rất nhiều mỡ và ngán cho ăn hết mấy đĩa này ngán quá không còn thấy ngon khi ăn mấy món Nhà hàng tính vat mình đã để lại thông tin viết hóa sau đó có gọi điện nhưng hiện giờ là nửa năm mà vẫn chưa thấy hóa đơn,neu
170,9.0, Nhà hàng nằm ở tầng đi thang máy vèo cái là view không gian nhẹ lịch sự phù hợp tiếp dẫn gấu đi nhân viên nhiệt đồ ăn ra Quá ít menu nhìn cũng k sang trông như quán bình dân,pos
212,9.2, Trời ơiiii gà xào bắp cải kìa anh em ơiiii đam mê nó quá lâu r và đi ăn đc lần và chưa bh hết thòm có combo để ace gọi cho đỡ tốn tìn gà xào có cả tokbokki và cơm trộn đi nếu thích thì gọi thêm phomai tầm ăn đến đơ người ra thì thuiii được nhân viên xào hộ nên k lo bị cháy kiểu ăn vừa miệng vô chín tới làm gà k bị săn quá cũng k sống tokbokki thì dẻo Đi kèm còn có cả kim chi với salad các thứ mà gọi thêm bnh cũng đc vì nó trong combo có cả coca pepsi các thứ đi nồi canh rong bỉn và nc lọc nữa huhuuu quá là tận tình chu Thêm nữa la nhân viên siêu nhiệt tình và vui Dù bọn mình siêu lầy nhưng vẫn vui vẻ tươi cười trả và còn xinh nữa còn đc chụp ảnh bằng máy ảnh lấy ngay nữaaaa quá nói chung là nhất định sẽ đi ăn n lần nứaaaa,pos
138,9.0, Ngon nóng này ước gì ở đâu có bể bơi kem,pos
523,4.4, Quán nhỏ nhưng được cái sạch mình gọi mang về bánh bánh bột mì quảng và chè chuối Bánh căn không có gì đặc bánh bột lọc thì theo khẩu vị của mình thì không được thích cho Được cái chè chuối rất thơm và ngọt Lần sau mình sẽ quay lại nhưng chắc chỉ ăn chè chuối thôi,neu
900,4.0, Trà xanh kem tươi và bánh khá ngon và Nhưng bánh và đồ uống giá khá Nội thất đẹp và phục vụ Quán ở góc nhưng có nhược điểm là chỗ gửi xe khác chật và vòng vèo đường mới sang được,neg
49,9.0, Rất nhiều hàng kem trên phố Tràng Tiền gốc luôn vì kem Tràng Tiền có ở khắp mọi bạn tuỳ thích lựa hàng nào cũng đông tấp Các hàng kem nhỏ ở ngoài đường giá rẻ cốt kem béo ngọt nhiều nên ngậy Hàng kem to đông người ở phía trong chỗ bảnh hiệu KEM TRÀNG TIỀN thiệt bự với nền màu xanh thì cốt kem tan trong ít ngọt ít béo Vậy mà nhiều người mua xếp hàng đông lắm Chắc vì hàng này chính Mình thích cốt kem béo Thích nhất là kem que vị vừa thơm vừa ăn thích thôi,pos
587,4.6, Vào pizza hut gọi pizza và mỳ ý voi may nguoi Chưa bao h ăn món mỳ ý nào siêu tệ và nhạt nhẽo như ở Pizza thì cũng chả đặc sắc và hấp dẫn như Pepperonis hay Ko bao h muốn quay,neu
815,3.4, Mình ăn nhắng nướng thấy có vẻ không thích câc món ướp khá giống có cái món ướp mẻ thì khác nhưng mà quá nồng vị nhắng thì quá dai nhai mãi không mà còn quá nhỏ chắc được mấy người ăn cả nước mà ăn xong như kiểu chưa ăn gì ý,neg
362,4.6, Cảm nhận ban đầu của mình khi đến với quán là khá bé đó là cơ sở gần ga hn Thái độ nhân viên phục vụ rất oke nhưg về bánh ăn cảm thấy k hợp khẩu vị Nói ngắn gọn là bình thường,neu
240,10.0, Salad cá hồi tươi ngon hấp dẫn,pos
770,3.8, Gọi mỳ bay ăn thử xem Hỏi a phục vụ suất này dành cho người ăn đc A í bảo cho ng ăn Đợi hơn nửa tiếng ra thì ôi mẹ có tí mỳ treo trên cái bát súp nấm ăn cũng chăng có gì Thêm con tôm và miếng kimpap Súp thì nhiều mà mỳ thì vài sợi cũng chẳng có thìa thì ăn kiểu quá K hiểu suất đấy có gì mà đắt Chỉ thắc mắc vậy,neg
713,1.4, Người bán chảnh và thiếu văn Phở tàm tạm kg như quảng cáo trên truyền Chỗ ngồi và để xe chật Thái độ của người thu tiền rất khó chịu khi tôi đưa và có đếm lại tiền bị mắng xa xả kêu đàn bà gì mà đếm tiền chậm Ăn uống thì cứ bị người làm hỏi đã trả tiền trước Khach vào ngồi chờ rất Chất lượng thì bình Thịt bò xào rất mỡ và thiếu độ ngọt thơm như các hàng phở nổi tiếng như Bát Hai Bà Trưng,neg
576,4.2, Worst service and teas It took them and times of reasking to get cups of tea For hot tea they gave no spoon and instead put one straw in one of the Took them mins and times to get the right bill and Their toilet was a nightmare which definitely says how much the management cares about the The nice reviews about the place make me doubt the credibility of Foody rating,neu
751,4.0, Mình thấy quán này ăn nhưng mà hơi chỗ ăn không được rộng rãi lắm,neg
916,1.0, Hôm trước mình vừa ăn ở King Hoàng Đạo Nói thật chứ hồi xưa thì phục vụ tận tình mà bây giờ thì nhân viên kiêu không tả Gọi gì cũng bảo tý tý gì mà to thế chờ cơm trộn mà tận hỏi thì quản lý bảo cái này phải làm nóng lâu chứ không phải múc ra là xong mà nhà hàng đông nên phải Ai cũng chờ nhưng kiên nhẫn có bạn nhân viên nào đi qua cũng hỏi gọi món chưa ạ mình nói là gọi cơm trộn đang chờ lâu quá bạn vào xem hộ mình xong chưa thì vâng xong mất hút hàng lươn luôn =_= Chưa kể mấy bạn bảo vệ xe mới cứ kiểu như chúng mày là khách đi xe máy nên chúng mày tự đi vào tao ko quan tâm Mình đi xe vào chỗ trống thì bảo ra mình lùi ra không được vì vướng bảo là em để ở đây đi Thề với trời là mình nói nhỏ có dạ đàng hoàng thì bảo đi để đấy hỏng thì đền chứ làm xong cười như nắng giữa gió mùa đông bắc Khách đi ăn trả tiền chứ ăn xin đâu mà làm như ăn cơm từ thiện vậy mà trong khu Trung Hoà toàn người nước ngoài mà còn thế thì xấu cả người Việt ra hay là sính ngoại kỳ thị nội vậy Đây sẽ là lần cuối cùng đến đây luôn Thân ái chào quyết,neg
419,4.8, Mình ngồi ngay tầng thấy quán decor cũng khá Đồ uống thì ổn tùy Trà sữa của mình khá pha bằng topping nên có vị ngậy khá nhưng uống nhiều bị ngán Còn trà đào bạn mình không rõ vị viên cũng nhanh Nhưng mà chủ quán thì thật sự có vấn Bọn mình ngồi khá lâu sau thì thấy chủ quán Vừa mở cửa mặt mũi đã nhăn nhó quát nhân viên loạn Ngay từ cửa đã quát bác bảo rồi ngồi ngay cạnh bàn của mình mà nói rất Bạn mình đi lấy xe còn thấy chủ đứng văng tục ngay bên Bọn mình thấy chủ quán coi thường khách quán đang yên ắng đi vào cáu nhặng lên là sao Có nói nhân viên thì nói ở góc sao phải quát từ vỉa hè đến trong quán như thế Không có một tí tôn trọng nào dành cho khách Bọn mình thấy thương bác bảo bác rất tươi dắt xe hộ bọn không biết lương được bao nhưng đáng tuổi bổ mẹ chị chủ mà chị ý quát như ơn chủ quán mà quán này vào blacklist của mình luôn nhé,neu
626,3.4, Hôm nay cơ quan mình có mua hộp ở Bình thường vẫn ăn ngon lành không Nhưng hôm nay có tới hộp bị các hộp còn lại ăn cũng tạm nhưng có mùi không được Anh chủ cửa hàng cũng nhiệt tình và đồng ý đổi lại cho Nhưng mong rằng về sau sẽ không bán hàng cũ như thế này Cũng hơi cân nhắc xem có còn lần sau nữa hem,neg
878,1.0, Ship hàng quá Hnay mình đặt bánh lúc Hẹn ship qua mà tiếng sau gọi vẫn còn chưa làm gọi lại kêu thêm phút nữa bên mình mang bánh qua thì phút cũng k thấy Đành gọi điện kêu huỷ đơn thì chị trực đt kêu e đến nơi r xong vãn k thấy ng,neg
851,1.2, Nói chung là một lần và mãi mãi ko bao giờ trở lại,neg
739,3.0, Mình ngồi nhièu quán cafe ở hà nội nhưng veef phục vụ thì ko một quán nào có thể chán bằng kodo xã mình bước vào quán lúc em nv order có vẻ mới làm ngồi dò tên từng loại đồ Gọi cốc nước mà đứng đợi hết hai bài nhạc chưa Sau đó thì đi bộ lên tầng để tìm chỗ trc khi gọi đồ nv cũng ko thôngg báo là hết chỗ cho Được một phòng có hai bàn rời em nv hứa lên hứa xuống là sẽ xếp chỗ cho nhưng cuối cùng mình phải tự tay kê Ngồi đợi phút chưa thấy nước hỏi nv thì em thỏ thẻ em chỉ là nv phục vụ thôi cũng ko Đợi gần tiếng đến mức ko thể đợi được nữa bọn mình xuống về thì thấy bàn ở tầng lúc đến chưa có mà lúc về đã uống gần xong cốc biết các bạn là nv mới hay quen hay chưa quen nhưng khi đã đứng quầy thì phải chịu trách nhiệm với cv của Ko phải đến cuối tháng ngủa tay ra nhận lương còn muốn phục vụ nhanh chậm thế nào cũng Hà nội có cả nghìn quán cà các bạn phải pr thế nào người ta mới bước chân Nhưg đáp lại là sự phục vụ ko thể ngửi nổi Hôm nay là sinh nhật đứa bạn kodo cafe đã phá hỏng buổi tối xinh đẹp một cách ko thể hoàn hảo,neg
287,9.8, Mình chưa bh check in trên foody nhưng lần này bắt buộc phải check in vì quán ăn quá nhân viên phục vụ chu từ khâu đặt bàn trên mạng với khách đã vô cùng lễ cho tới a chủ cũng hết sức thân thiện ra từng bàn để chuyện trò với ăn thì quá khỏi bàn Mình gọi bạch tuộc xào bắp cải và bạch tuộc sống loại canh miso và nước thiệt hại nhưng mà no căng check in còn được tặng thêm cốc Pink lady Nói chung quán quá mình là người đi ăn rất nhiều nhưng phải công nhận đây là lần đầu tiên mình cảm thấy có quán phục vụ tốt như Chấm điểm,pos
139,9.0, Đã mất công lên tận Cầu Giấy là phải đi tour các hàng Cũng cho quán vào tầm ngắm lâu lắm rồi mà hôm nay mới có dịp đến Quán nằm ngay mặt đường có Không gian tầng ngồi vẽ tường siêu trẻ con mà đến đây thì thích Vì là giữa trưa và mưa nên mấy chị mình ngồi trọn tầng lăn lê bò toài thoải con nhà bà Menu có nhiều loại kem và đồ kem tuyết vụn vụn nhìn như dừa nạo mà ăn rất đồ uống cũng cốc to mà đầy ú Nói về lẩu kem thì tuyệt rẻ và bày cực đẹp long lanh Đi ăn các hàng mình không ăn được kem vị trà xanh vì nó cứ ngái ngái nhưng ở đây ăn lại khác Mình gọi set lẩu kem nước uống và kem tuyết mà hết có ngồi cắm chốt cả Chị chủ quán sinh năm cũng rất nhiệt nói chuyện thích Sẽ phải quay quán ủng hộ nhiều lần nữa,pos
723,2.2, Mình sống ở Hn gần nhưng chưa ăn Phở Thìn Lò Đúc lần vì nhìn cái sự đông đúc chật chội là ko thíc Lần này miễn cưỡng đi ăn vì ng bạn ở xa đến Hn muốn thưởng Mình và cả bạn mình có chung nhận chỉ có tái áp nhiều dầu quá nhiều nước phở đục ngầu và ko có cái vị j gọi là Ko cũng ko rất hổ Không chật đông Phục trả tiền tự kiếm chỗ ngồi xác là đứng thấy ai ăn xong thì nhanh chân chen tự bưng bê nếu muốn Bỏ tiền đi ăn mà như đi mình và bạn đồng ý không giống và ko bao giờ quay Ở Hn cũng có nh quán ngon nổi tiếng mà mình thấy hài Đây là cảm nhận cá bạn nào ko đồng ý thì cũng đừng ném đá nhé,neg
492,5.0, Cứ ăn đà này chả mấy thì lăn ngon,neu
484,5.0, Bún đậu đầy đủ ng ăn đi vào tầm tối sắp đóng cửa nên đc cô cho nhiều hơn hẳn,neu
915,2.8, Đồ ăn steak còn nguyên vụ cũng kém,neg
307,9.0, Quán rộng nhiều tầng là minh Có rất nhiều ánh nắng chiếu vào Học bài cugx rat Báh bao kim sa ở đây công nhận quá ngon,pos
243,10.0, Đồ ăn không gian ấm sạch nhân viên vui nhanh Thế còn muốn gì đây dịp cuối trước khi đến cũng nghĩ cuối tuần sẽ không hoàn hảo nhưng sự thật lại Nhân viên đồ ăn phong xuống nhanh Mình ngồi khá muộn nhưng nhân viên không tỏ ra mệt mỏi hay gì Chắc cũng do quản lý training chứ các em làm vậy cũng mệt Sẽ đến đây nhiều nhiều Các bác cứ đến Đảm bảo hài lòng trọng là không khí Noel ngập và tràn luôn Noel này cứ đến muộn và ngồn lân la ở Đường đông đi mệt,pos
191,10.0, Mình và bạn mình mua voucher set VIP qua đây giác ban đầu là không gian lịch sự sang viên vui ăn thì viên phục vụ nhanh chung là mình rất hài đi ăn buffer lẩu nướng thì mình sẽ tiếp tục chọn ở,pos
619,1.4, Đang định có thiện cảm vì kem ốc quế lại ngon và giòn như trước thì lúc mua kem que sữa dừa và đậu xanh là cây mà cô mình giọng đưa tờ chỉ đưa lại ko trả lại thật sự thật xấu hổ thay cho đấy là người VN với còn ko biết với khách du lịch họ còn thịt bao nhiêu Lúc ăn kem chanh ở Thuỷ Tạ cô bán hàng từ chối bán vì ko đủ tiền trả mình rất bực nhưng thà như vậy khéo còn tốt hơn là những người như à nói nốt là sau đó mình đã cố gắng tìm tờ mệnh giá nhỏ hơn và cô ấy bán kem haizzz,neg
840,2.2, Nhân viên không lịch thái độ chợ búa,neg
118,9.2, Quán sạch đẹp đồawn rất ngon,pos
163,9.6, Đồ ăn chuẩn vị mình hay đi cùng chồng đến đây ăn Lần đầu đi hơi chủ quan ko nghĩ full bàn nên đến rồi lại đi các lần sau mình đều alo đặt bàn trước và đặt bàn bên cửa sổ để được nhìn view hà nội buổi tối lung linh Món ăn ko nhiều nhưng các món đặc sắc của dimsum đủ Mình thích nhất ăn bánh bao nướng và chân Món chân gà ướp vị vừa mềm tan trong Món cháo và các món tráng miệng ở đây cũng Ăn chơi thì hay ho hơn là ăn để no vì ăn no nhanh ngán Chi phí khoảng chừng là ăn ổn ổn rồi cộng nữa đó là phục vụ chuyên wc cực sạch và tương đối hiện bước vào nhà hàng là thấy không gian dễ chịu thoải mái rồi,pos
198,9.2, Không gian được đầu tư hơn những Dingtea Đồ uống ngon nhưng chờ hơi Nhân viên nhiệt Có thẻ tích,pos
819,4.0, Ny mình với bạn ổng thích chỗ này hay rủ mình đi mình thấy cũng tẩm ướp khá ngon nhưng giá hơi bị mình với ny ăn vèo cái hết gần với lại nhân viên láo nháo quá gọi mấy lần toàn quên mang Nói chung đi ăn với mấy ông mình mới tới chỗ nếu chọn đi ăn cùng bạn bè mình sẽ chọn chỗ bớt láo nháo giá thành mềm hơn mà ngon ko kém,neg
26,9.0, Hôm trước đi ăn với cảm thấy quán rất là ngọt viên phục vụ niềm cẩn cả hợp và mọi người nhất định p ăn ở đây một,pos
