,Rate,Review,Label
843,3.4, Nhân viên phục vụ thái độ cực kỳ khó Hơn nữa trả thiếu tiền cho về nhà kiểm tra lại mình mới Lúc đầu mình gọi trà sữa ô lông thêm trân châu nhưng nhân viên nói phải đợi phút mới có trân châu nên mình Hoá đơn trôi ra cũng đề mà mình đưa lại trả Đáng lẽ không có trân châu phải trả mình Sẽ không quay lại lần sau,neg
896,3.0, Mình ăn ở chi nhánh trên đường Kim Liên Và chắc chắn là sẽ không bao giờ quay lại lần viên đông nhưng làm việc không hiệu chạy ngược chạy ồn ào và hay soi khách làm mình thấy không thoải mái mà nói thẳng ra là hơi khó ăn không ngon và Mình đi bọn mình gọi ram bánh bún bò và mỳ huế đc chiên quá lửa nên bị cháy còn mặt thì mềm nhũn do nhân ướt chấm tương đậu hoàn toàn ko Bánh lọc thì bột nc chấm nhạt Mỳ quảng là khó chấp nhận sợi phở thái bản to chứ ko p sợi mỳ nát vụn bở và kiểu để thịt lợn khô Bún bò vô thưởng vô ko ngon cũng ko Nói chung chất đồ ăn rất ko chấp nhận đc chứ đừng nói đến việc so sánh với đồ ăn trong hãm nhất là ko có giấy min hỏi xin e phục vụ giấy ăn khô thì em í bảo chỉ có khăn ướt ép khách dùng khăn ướt để tăng thêm khoản thu lên thanh toán hết gần Lại còn nghe nhân viên xì xào nói xấu khách bàn nào đó chung là đi ko trở Ko hiểu sao vẫn đông,neg
105,9.4, Hàng bánh tráng trộn nổi tiếng phố cổ nay đã chuyển về gần hơn rồi đây lại còn chuyển về khu tập trung đông sinh viên nữa lúc nào quán cũng đông khách nhưng vẫn đảm bảo phục vụ nhanh gọn dã gọi bánh tráng bánh tráng bánh tráng cuộn mỗi thứ một loại ăn thử cho tráng trộn rất chất lượng đã được rất nhiều người kiểm định thì khỏi một suất đầy đặn có bánh khô gà khô lạc rau thơm và trứng ăn đậm tráng bơ hơi nhạt nhưng thơm ngậy vị bơ và Bánh tráng cuộn cuốn vừa miệng đầy đủ tôm khô gà khô bò lại còn có sốt mayoisne rất ngon bạn sinh viên khu vực Bách Kinh Xây lại có điểm ăn vặt lý tưởng nữa,pos
760,3.4, Rất thíc ăn kichi nhưng những ngày cuối tuần or crazy thì ở phạm ngọc thạch chất lượng của supervisor quá tệ địa điểm đen k bg quay lại Làm sup như thế thì chắc nv cũng như vậy Khi khách gọi đặt bàn ok chị đến e xếp chỗ biết những ngày này rất đông đã đợi rất lâu còn hét lên vào mặt khách là hết rồi k có chỗ thế thì lúc đặt bàn nên nói trc hoặc phải biết cách sắp xếp trong khi bàn bên trong còn khá nh chỗ trống Cũng chuỗi cửa hàg nhưng gđ mìh hay ăn ở vincom và tăng bạt hổ các achi cực kì nhiệt tình và luôn biết cách làm vừa lòng khách hàg,neg
189,9.6, Tôi tổ chức sinh nhật ở đây thấy các bạn khá nhiệt tình chuẩn bị trang trí mừng sn cho Ăn thịt thấy ướp gia vị vừa Tôi rất thích món thịt ba chỉ nên gọi khá Nhân viên nướng ngoan dễ Gọi liên tục vẫn niềm nở chứ không như mấy hàng gọi thêm có đĩa mang ra thịt mỏng dính vài miếng mà vẫn mặt nặng mày Bánh giọt nước khá bạn mình phải ăn suất Vote cho quán có dịp gì lại tổ chức ở đây,pos
850,3.6, Quán bé do quán vắng mình chó đến ngồi ngoài chứ không vào cũng bị nhân viên thái độ,neg
221,9.0, Quán với menu khá đa dạng và phục vụ cũng khá đến vì xem tarot miễn phí ở thử cũng khá okie nà,pos
458,4.2, Không thể tưởng tượng Gogi House cùng chuỗi với Sumo chuyên thịt mà thịt ướp nhạt viên thì tụm lại nói phục vụ tốn thời nhân viên không chuyên không quay,neu
295,9.0, Thử qua rất nhiều thương hiệu trà thì Bobapop vẫn luôn làm mình ưng ý Ngon giá cả vừa phải nhân viên lại thân lịch sở thích nên lúc nào mình cũng gọi xanh Nhận thấy xanh sữa ở đây ngon hơn feeling sánh ngang dingtea và gongcha mà giá lại rẻ hơn haha,pos
340,4.4, Nước chấm có đĩa rau ăn phụ vụ chu Tuy nhiên bánh rán và bánh gối hơi nhiều Thịt không được tươi và bị nhiều nên nhiều mộc nhĩ và hành Với lại rổ bánh mà che đậy thì sẽ tạo cảm giác yên tâm hơn cho ng,neu
836,3.4, Mình ko hiểu đây là món ăn đặc đặc sệt sệt ngang ngang lợ chả ra cái kiểu đi qua đông khách ghé vào ăn thử mà khều vài đũa đứng gọi bát đặt biệt hình như hay gì thật sự ki bao giờ quay lại lần,neg
57,9.0, Kem tràng tiền vẫn luôn là nhấttt,pos
846,3.6, ăn cao so khung ăn ra hơi nhân viên nam khi chi ăn,neg
772,1.0, Mình kh thể bình luận gì thêm về mọi thứ của Quá tệ,neg
65,9.6, Kem thành thương hiệu nên cứ nhắc tới kem là nghĩ đến kem tràng tiền kem ngon nhưng mặc dù có thùng rác nhưng số rác vẫn k bỏ vào mùa hè ăn kem tràng tiền là ngon nhất,pos
439,5.0, Kem chè ở đây nổi tiếng nên mình cũng lân la Thấy mọi ng đến ăn ăn phải gọi đến cốc liền mà mình vs ny ăn k thấy ngon là sao xôi bé kem quá Xôi thì dẻo và cũng thơm nhưng mà cốc kem xôi ít cho cốc này k bõ ý k bằng ở Phan Chu Trinh luôn Thái Lan được múc sẵn khách thì quán múc đá vào thôi là Cảm giác mất đi phần ngon rồi xong chè ăn thì mình chẳng cảm nhận được vị gì cả ý mỗi cái không gian rộng mát mẻ với chỗ để xe thoải nói chung là sẽ k quay lại nơi đây đâu nhạt và rất ít đồ,neu
844,3.2, Lần đầu đi uống cho biết nên chưa rành menu lắm hổ bạn chủ quán có món nào dễ uống nhất b giới thiệu cho cái xanh quất chân châu uống mà phát tởm,neg
531,5.0, Nếu không vì sợ béo chắc mình uống trà sữa mấy tuần Quán hơi bé nhưng chất lượng đồ uống thì tuyệt Mình nghiện trà kem mặn ở Vị trà khá thơm và đậm Trân châu thì khỏi nói khá nhiều và đậm vị không Thích ăn trân châu bảo quán cho thêm cũng sẵn sàng và không thêm Mình hay ăn trân châu lẫn giữa trân châu trắng và Một cốc trà to ứ ự bằng size M của các hãng trà sữa khác mà giá chỉ bạn sẽ có cốc trà to vật có sẵn trân Vô cùng ngon và tiết Độ ngọt trà vừa phải không bị quá Quán đúng chuẩn ngon bổ rẻ,neu
933,4.0, Hồi sinh viên vẫn thỉnh thoảng cùng bạn bè qua nhưng chất lượng càng ngày càng giảm đi,neg
372,4.8, Ờ thì đồ ăn cũng nhưng chẳng hiểu sao quán làm ăn quá chậm chạp mà hay quên đồ khách món phải mất tầm mới ra thế lại còn như cái quán sắp phá sản tính ra cứ gọi tầm món thì có món không có hoặc vừa thất vọng và ko muốn quay có lẽ trả thêm vài chục để dùng dịch vụ khác còn,neu
849,3.0, Quán chật phục vụ không thân ăn gimbab không có sốt mayonaise gọi đồ uống không có đá Được cái đồ ăn tuy vậy menu quá nghèo mấy món khác mình ko để ý nhưng đĩa cơm thăn lợn chiên giòn đắt hơn cả K food wt takeaway thì ok nhưng ăn ở đấy thì là phương án khá quay lại lần,neg
159,9.0, Ăn ở đây suốt đồ uống muôn thuở k Bánh tráng nướng thì cơ mà k ngon bằng ngày xưa,pos
536,4.6, Thường thì đến đây chỉ gọi tào phớ thui vì ngay tên cửa hàng đã đề cập rồi Tào phớ ở đây giá cao hơn chỗ khác một chút nhưng chất Tuy nhiên chỉ nên ăn tào phớ thôi có vài lần mình thử trà sữa thì hơi dở một chút vì ko thấy vị trà mà toàn mùi bột ngấy vô Giá thành đi cùng chất lượng nên thì cũng coi là tào phớ mới ra hồng trà và trà xanh kem mặn Sự thật khuyên các bạn ko nên thử vì cá nhân mình thấy khó Lợ ko có vị kem tan vào nước rất nhanh,neu
460,4.4, Cộng là kỉ niệm cũ với Không buồn nhưng cũng k Chỉ là nghĩ tới nhìn thấy cộng là nghĩ tới người cũ mới quán có style lạ và độc là điểm kéo m vô chứ Giờ cộng mở khắp nơi nhưng chỗ nào cũng đông và đây là lí do m không muốn vô lại,neu
467,5.0, Nói chung là tớ đã được vào ăn đồ huế mấy lần nên cũng có tí gọi là Nhìn chung quán khá dễ tìm chỗ ngồi thoải Đồ ăn thì đc mấy món hợp còn bún bò và món bánh đa súc hến thì k ok Hến ăn hơi mặn nhiều lạc và hành Bún thì nước k đc ngon và chả có vị gì đặc Lần sau chắc thôi k đến nữa vì thấy k ngon lắm,neu
15,9.4, Quán nằm khá sâu so với mặt đường nguyễn hữu trời ơi cực thích hợp với những đứa ưa chui rúc ưa tìm tòi như mình lắm luôn đó để xe ở cách đó tầm chục mét gian rất sạch sẽ gọn đây cafe là nhất quả Đây là nơi thân sinh ra món này mà sinh ra luôn cafe trứng của vụ nhanh nhẹn Mọi khâu chuẩn bị luôn sẵn sàng mà chỉ đợi khách gọi đồ là bê ra thui còn quay lại dài hơi,pos
995,2.6, Hôm trước mình mua gói bánh gối cho ông bà ăn sáng thì giở ra bị mốc nhưng mà ngày sản xuất thì ghi hôm đó sản Nhân viên cũng điêu Thương hiệu bao lâu năm giờ giảm uy tín hẳn Cứ có tiếng chút là làm ăn hời hợt luôn,neg
294,9.6, Thi xong mấy đứa rủ nhau ra bobabop Lần đầu uống bobapop vì chỉ chung thuỷ với dingtea nên k biết chọn vị Con bạn chọn cho vị trà gạo nâu sủi bọt thêm topping flan với trân châu Cảm nhận đầu tiên thấy dễ uống vị thanh thanh k quá ngọt vì mình chọn giảm nửa đường Flan trân châu cũng như các quán khác nhưng cảm giác k ngon bằng Vị gạo nâu lắc đều với kem mặn uống khá là thú vị thơm nhè Quán view khá đẹp yên Chắc chắn sẽ thử những vị,pos
722,3.0, Tối nay lặn lội đi từ Cầu Giấy lên ăn bát phở và thất vọng toàn Thứ gọi bát xong và phải trả tiền Thứ quán quá ngồi ăn như trẻ con mẫu chẳng thấy ngon chỗ nc phở đục ngầu và chẳng thấy có mùi vị gì của Thứ thái độ phục vụ quá kêu chai nc ngọt mà chủ quán bảo a phục vụ kệ bê phở trc đã Nói chung lần và mãi,neg
727,2.2, Quá chỗ ngồi chật chội và đắt so với mặt bằng chung của Hà sao người hà nội lại khổ vì ăn đến hàng hết chuyển sang quán nước chè bên vừa ăn vừa nghe bà bán nước chè chửi,neg
563,5.0, Mình order có suất trà sữa là các bạn ý hẹn CHỜ MÌNH cảm giác nó thành bộ ngực của Elly Trần TÍ to có suất trà sữa thôi mà đến tiếng đồng thành cảm ơn sự phục vụ của quý hàng PHIÊU LINH TÍ,neu
781,3.6, Quán tuy nhiều đồ ăn nhưng đồ ăn đem ra nguội ngắt nên thành ra ko ngon,neg
376,4.4, Đặc thù ở đây là có một dãy các quán bán chân gà Khá nhiều Thậm chí có quán còn nằm ở sâu tít bên gần cuối về chân gà nướng thì quá nổi tiếng nên khỏi cần Chân gà tẩm mật nướng giòn trên Ăn sẽ ngọt và có dư vị đọng trong Ngoài ra còn có bánh lòng cánh nhiên khi ăn cần cẩn hôm mình có đi vệ do quán khá đông nên mình phải đi vào gần trong bếp nên phát hiện ra chế biến cực mất vệ ngoài ra còn nghi ngờ đây là chân gà nhập của trung có tẩm chất chống hỏng rất nguy hiểm cho sức mong các bạn cân nhắc khi ăn,neu
111,9.0, Mặc dù quán ở trong ngõ nhưng dễ tìm vì ở ngay đầu viên nhiệt nhanh nhẹn quán chỗ nào cũng được trang trí rất đáng từ cái thìa cái Quán có cách phục vụ Mỗi cốc nước đều được đựng trong khay có cả chậu hoa bé xíu và tờ giấy ghi tên quán và lời chúc đằng bánh và đồ uống đều rất Mỗi loại đồ uống còn coa thể gọi thêm kem hoặc kẹo bông Trong ảnh là bánh chậu cây và hot milk không bị quá dùng chung với nhau rất,pos
296,10.0, Trà sữa gạo nâu ở Bobapop ngon viên phục vụ nhiệt đồ uống cũng lại là ưng đồ ở đây lắm,pos
440,4.6, Được bạn giới thiệu đến đây ăn thử nhưng thật sự thất vọng vì kem không hề dừa khô hình như là tự làm ăn không ngon chút bào So với chỗ mình hay ăn ở gần trường Trần Phú thì kem ở đây khác xa cả chục mét Ăn lần và sẽ không có lần thứ,neu
541,5.0, Hnay đi ăn gọi phô mai chiên pizza margarita và áp chảo fajitas Đối với món phô mai thiếu lá oregano làm ăn chả thấy ngon với lại Pizza cũng k có gì đặc biệt k hợp khẩu vị mình Còn món cuối là áp chảo fajitas có kèm quả bơ phô mai kem cuộn vào cảm giác như đống hổ lốn trong mồm Tốt hơn hết là ăn vã thịt Gì cũng chê mà chỉ k chê thịt bò Thịt bò ở trong có màu hồng đào ăn vừa miệng và rất,neu
182,10.0, Món ăn thái độ phục vụ nhận viên thường xuyên qua ủng hộ cho nhất món cơm tấm sườn ở quán,pos
501,5.0, Mn mở từ mấy h,neu
614,3.4, Mình là một người khá khó tính trong chuyện ăn theo mọi người nhận xét là sành Nhà cũ của mình ở ngay Hàng cách quán cũ của Giảng số Hàng một Khi Giảng tách ra thành địa lúc đó mình mới đủ tuổi được uống cafe và từng đến cả quán mới để thưởng mình thích hương vị của Giảng ở Nguyễn Hữu Huân hồi đầu Giờ quán thiên về quảng cáo theo cảm nhận của bản thân mình thì mất đi phần nào đó hương vị của ngày xưa tại mình khó rồi mình không còn quay lại đây Khi giới thiệu cho bạn bè hoặc mỗi khi tụ mình toàn ra quán Giảng ở Yên Phụ,neg
286,9.6, ăn bát tưởng bình ai ngờ to thật ăn no vị bột gạo ngon nhưng ko có kem nói về vị thì mình thích matcha hơn tại n ngọt nhưng ăn một bát rất đáng tiền không gian yên tĩnh thoải decor mùi thơm phục vụ nhiệt tình,pos
827,1.4, KHUYÊN CHÂN THÀNH LÀ KHÔNG NÊN ĐẾN ĐÂY ĐÚNG KIỂU LỪA ĐẢO MỘT XUẤT ĐẾN ĐƯỢC CHO NỬA CON CON BỀ CON HÀU CÒN LẠI TOÀN MÓN VỚ THỊT BÒ LÀ THỊT LỢN mà mọe ghẹ có một được cho nửa con còn bị thối chứ ôi điên QUA ĐẶT CHỖ ĂN HỘ BẠN Ở NƯỚC NGOÀI MÀ VÀO ĂN XẤU KHỔ KO BIẾT RÚC MẶT VÀO ĐÃ THẾ CÒN MỘT EM PHỤC NHẶT ĐĨA CỨ ĐỨNG LƯỜM NGUÝT ĐỂ KHÁCH CHÁN BỎ VỀ ĐIA ĂN NHÀ HÀNG NÀO VỚ VẨN NHƯ NHÀ HÀNG NÀY CHỈ CHỤP ẢNH LỪA ĐẢO LÀ GIỎI,neg
230,9.4, Cơm viên nhanh nhiệt đồ ăn lên cũng nhanh Nói chung là rất hài,pos
632,2.2, Lúc đầu mình mới bước vào quán thấy hơi ngộp vì quán bé nhưng lại rất Sau khi khá vất vả mới kiếm được chỗ ngồi cho người và order luôn kem trái dừa trứ danh của tiệm cùng chai nước suối để chống Kem mang ra khá nhanh và trang trí khá đẹp Và khá to nữa nhưng ăn muỗng đầu tiên thấy kem toàn đá ăn mất Chỉ được mỗi cái dừa bên trong là Nói góp ý tý với quán là nên có nước dừa cho khách uống kèm kem cho đỡ Thêm nữa là kem nên cho thêm sữa bớt nước cho đỡ lạnh vì toàn đá với chả cảm nhận được vị,neg
733,3.0, Ngày trc vô sg bạn dẫn lên Bùi Viện nên bạn ra HN m cũng đưa đi Tạ Hiện cho Chứ bt m ngại đông đúc chen chúc nên chắc chả bao j mò lên đây hiểu bia kiểu j mà uống về đau đầu cả tuần,neg
690,3.4, Lần đầu được ăn bánh mỳ sốt Nhưng do tâm ly sợ ăn quán vỉa quán Việt vì họ làm bẩn khó Ăn cũng được nhưng vẫn mang tâm lý sợ bẩn vì nhìn quán không mấy có cảm chỉ dám ăn bánh mỳ chảo sốt vang không dám ăn dưa cố gọi cốc nước sữa đậu nành mà không dám uống vì nhìn cốc người ăn phần nước hết cũng đâu phải rẻ đâu các thím lẽ mình ăn bánh mỳ tam giác vẫn là ngon an toàn,neg
804,3.4, Nghe đồn là quán này có từ rất lâu Chất lượng được gọi là tạm nước dùng ngọt mùi hẹ và mùi mỳ Giá khá dễ chắc do thế nên đi kèm với số lượng đồ ăn và chất lượng phục vụ chẳng ra làm Mỳ thì ít lèo miến trộn thì lác đác vài miếng thịt Quán thì vừa bé vừa Mình có lôi điện thoại ra chụp đồ ăn để về viết review thì mấy bạn nhân viên trông có vẻ rất đề phòng Chắc bản thân cũng ý thức được quán mình không ổn nên sợ,neg
958,1.0, Kinh khủng đơn giản là quá chán và một lần và mãi mãi cho quán,neg
659,3.2, Thức ăn không Để tủ lạnh quá Nấm cho vào lẩu bị rau chưa rửa Nhân viên phục vụ cứ vâng rôi không Rượu toàn bia tươi thì không đạt yêu không bao giờ quay,neg
371,5.0, Mình gọi suất nướng xèo Nhật nhưng thấy ngán do nhiều dầu cũng nướng tẩm ướp na ná nhau nhưng lại hơi Ko đặc vụ do chạy nhiều bàn nên bàn mình thịt toàn bị,neu
522,4.2, Lần nào mình đi cũng đóng Hay là nhầm địa chỉ,neu
618,4.0, Hôm nay đi dạo qua nổi hứng muốn thử kem ốc quế vì trước nay chỉ mới thử kem que ở Tràng Tiền viên thì ko thân thiện mà cứ chậm Nhưng thất vọng nhất là kem vị cacao vị ngọt lờ chẳng có vị cacao Kem cũng rất rất nhanh kiểu mềm Ốc quế ko ăn cứng thể lại cho một cây kem ốc quế vị dở tệ là ko chấp nhận đc đối với một thương hiệu nổi tiếng như Nói chung từ nay mình sẽ chỉ trung thành với Bodega gần chất lượng gấp đôi mà giá thành rẻ gần nửa,neg
799,4.0, ấn tượng đầu tiên mình có là quán sập nhân viên thì đợi mãi chả có ai ra phục sau đó minh nhận đc service rất thô cảm giác như bị Anh quản lí thì ngồi chơi vs Nhân viên thì ngồi nch vs mình thì đứng như vô rất thất vọng về quán,neg
750,4.0, Vị trí Quán chia làm nhân viên đứng ngoài mời vợt vào gọi bát vàng siêu đặc biệt mà chẳng thấy gì khác lắm so bát bt ngoài nh hơn và có móng bt k ngon nhân viên đông mà phục vụ hời hợt k nhiệt k,neg
352,5.0, Quán Ngon ở Royal thì hơi đông hơn và không gian mở nên không đc riêng tư cho Mình đến ăn hai Lần đầu quên chụp hình món bánh đúc chấm tương đậm bún ốc chuối và bún Nước dùng ở Ngon đúng kiểu nc xương hầm chứ không nêm gia Lần thứ hai mình ăn cháo trai và bánh đúc Hai món cũng ngon vừa Giá thành hơi mắc so với các quán bình,neu
535,5.0, Tào phớ thanh không bị quá Tóm lại là,neu
547,4.6, Thái độ nhân viên phục vụ không mê mà trước giờ trừ GV ra thì mình chưa mê được thái độ nhân viên PG ở đâu nhìn khách như kiểu mày muốn gì mày nhanh nhanh nói với khách cũng với kiểu khách là pet còn các bạn ấy là xin lạy của em một lạy Không gian học bài ở đây không ồn mỗi tội ít chỗ quá nên lần nào mình đến cũng không tìm được chỗ ngồi Đồ uống bình được cái mình thích ăn thạch ở mát,neu
954,3.4, Ông bà Sáu nghỉ quán h chủ khác là mấy cô cậu trẻ Khởi nghiệp thì ok thôi nhưng mà nên làm chỉn ăn dở Phục vụ thì gọi tô đầy đủ thì tô có chuối tô tô có riêu tô,neg
271,9.4, Vì không thích ăn ngọt nên thường xuyên gọi bingsu hoa quả nào sợ ngọt thì có thể gọi mix dưa hấu và dưa mát lịm từ đầu đến chân luôn ra bingsu xoài ở đây có sốt rất thơm xoài k quá chua nên ăn rất hài chứ không bị kiểu đang ăn sữa ngọt cắn miếng hoa quả rùng cả mình đâu ai nghiện ngọt thì có thể vô tư thử tất cả các tất cả bột ở đây mình thấy đều vừa nhưng cảnh báo nên lấy sẵn cốc nước lọc sẵn ngay trong sạch sẽ và tiên để nhỡ có nghẹn bột còn uống kịp cái cầu thang thì chóng mặt quá,pos
730,4.0, Một bát với rất nhiều hành xin ít nước béo cho luôn bát ăn mãi chả Quẩy cũng nói chung tầm thì hợp lý,neg
79,9.2, mỗi lần lên đây phải ăn cho thiệt no cho bớt xa quá chả có nhiều điều kiện lui tới í,pos
925,4.0, Đồ ăn đa phong khá Giá cả vừa để xe rộng Không gian quán khá rộng,pos
99,9.0, Cực thích quán cafe này Không gian rộng decor đơn giản nhưng Chỗ ngồi rộng có nhiều khu khác Mình đã thử honey bread thì siêu Bánh khá lớp ngoài thơm phức mùi mật Lớp whipping cũng k bị ngọt Ăn bánh kèm hạnh whipping cùng vị ngọt của mật ong thì tuyệt Bingsu thì mình chưa thử vì hôm ấy hơi nhưng nhìn trông ngon Lần sau nhất định sẽ thử,pos
304,9.0, Lâu lắm r m mới đc review quán mà m hài lòng từ không gian địa điểm cho đến đồ ăn thế này chiều mùa hè đi ngoài đường nắng nóng oi bức mà đưa nhau vào chốn này thì đúng là sướng hơn tiên vẫn đc tiếng ngồi giữa phổ view nhìn thẳng ra hồ mà lại mát mẻ đẹp tự sướng check in đẹp lung linh wanna waffle nằm ở tầng phố đinh tiên bao nhiêu lần m đi qua r mà k để hoá ra là nó nằm ngay phía trên cirkle cứ tự tin gửi xe phi thẳng vào cirkle k r đi lên tầng là À mà ở đây k có chỗ gửi xe riêng của hôm m đến vòng đi vòng lại mãi ms gửi xe Các b đến thì cứ phi xe sang bên hồ gửi ở đây r đi bộ sang đường là tốn mất Lên quán r thì k gian bàn ghế đẹp lung linh đẹp từ cái cầu thang đẹp đi nhân viên cũng rất thân thiện nhẹ tư vấn đồ nhiệt ở đây tất nhiên nổi tiếng nhất là về waffle menu có nhiều set waffle cho b giá tầm hoặc b cũng có thể tự mix set waffle cho M gọi set waffle gì ấy m k có waffle ăn kèm kem sốt topping chuối vs ăn cũng ổn Tuy nhiên m highly recommend các c tự mix set giá cũng tầm thôi nhưng chọn đồ m thích ăn thú vị như set m mix gồm waffle nho kem xoài kèm sốt scotch gì ý nhưng ngon cực Ngoài ra menu cũng có các món bánh khác ăn cũng lạ và ngon như apple Ngoài ra có mountain cake thì m lại k ưng vị nhạt nhoà và ăn nhanh Đồ uống cũng khá đa dạng từ cf đến sinh tố nhưng cũng k có gì đặc đây chắc chắn sẽ là chốn yêu thích của m trong mùa hè mặc dù giá waffle hơi cao nhưng các loại bánh khác vs đồ uống thì giá rất phải hơn nữa có vị trí đắc địa và không gian đẹp đẽ này bù lại ngồi cũng thấy đáng tiền luôn,pos
734,4.0, Gần cty nên uống ở đây rất nhiều lần rồi nhg cách đây hơn tháng ghé vào đây với đứa bạn mà cảm giác đúng là ko muốn quay lại Không gian và địa điểm Khá rộng nếu so với các quán dingtea Chất Ko hiểu hôm ấy em pha chế bị sao mà vẫn món hồng trà quen thuộc mà nhạt thếch ko ra vị gì Nản tập thanh Hôm ấy giành thanh toán với đứa bạn nên lúc thanh toán em ấy hô giá bao nhiêu thì mình đưa luôn chứ chưa nhìn Đến lúc lên tầng nhìn vào bill thì thấy mình trả thừa mười mấy k Định đi xuống thì em phục vụ hỏi Chị đi đâu Mình bảo bị trả lại thiếu Thế là em ý đưa cho mình cái khay nước để tự bê lên tầng trên lúc sau em ý phi lên dúi trả mình vo tròn ko nói chữ nào luôn uống ở đây rất nhiều lần và lần đầu tiên bị vậy nên mình sửng sốt lắm đành bye bye quán gần cty vậy,neg
679,3.6, Nghe danh quán đã lâu nhưng chưa gần đây tiện qua nhà bạn ăn ở quán mình gọi bánh mì rất có miếng dưa chuột ok hơi đắt so với phần ăn nhưng nếu ngon thì mình chấp vấn đề là món ăn cũng chưa tới mức Quán đông nên phục vụ cũng hơi chậm thôi cũng có thể chấp nhận,neg
615,3.8, Giá phù hợp sinh viên học cơ mà lần đầu tiên đến cơ sở Tạ Quang Bửu thì thái độ phục vụ quá kém kiểu giống như muốn làm gì thì tự đi mà tao chỉ có việc đưa đồ ra đồ ăn thì ngon đấy nhưng phục vụ chán lắm luôn,neu
